"Sample ID","Sentence ID","Tree","Parsed","Valid","Sentence"
1,0,0,1,1,"take all cups , mugs , spoons , and forks and place in sink"
5,1,0,1,1,"give me the bag of chips"
6,0,0,1,1,"get all the plates , cups , and spoons on the counters and put them in the sink"
14,2,0,1,1,"prepare us food and bring the coke"
24,0,0,1,1,"123"
27,1,0,1,1,"take a bowl , ice cream scoop , and ice cream"
31,3,0,1,1,"carry glass , long cup , mug , long cup , pot , and spoon near the sink"
37,0,0,1,1,"test"
41,1,0,1,1,"bring us coke and the beer"
46,0,0,1,1,"grasp the spoon , fork , mug , and glass and bring to the sink"
50,1,0,1,1,"bring us chips"
52,0,0,1,1,"collect the plates , utensils , and cups and put them in the sink"
58,1,0,1,1,"bring us chips and coke"
58,2,0,1,1,"bring us the controller"
60,1,0,1,1,"scoop the ice-cream and pour syrup"
61,3,0,1,1,"put the garbage bag inside the bin and place near the wall and near the counter"
62,4,0,1,1,"and throw out any garbage"
69,4,0,1,1,"find and open the bag of chips"
84,0,0,1,1,"turn on the tv and xbox and connect them"
84,5,0,1,1,"open the bag of chips and pour them into the bowl until it is full"
89,1,0,1,1,"bring us the book and the bag of chips"
93,2,0,1,1,"bring us bag of chips"
93,3,0,1,1,"bring us the pillows"
110,2,0,1,1,"place the dvd in the tray and close it"
113,1,0,1,1,"take any drinks and put them on the coffee table"
113,6,0,1,1,"turn the volume to full"
117,5,0,1,1,"add cereal to the bowl until it is full"
125,2,0,1,1,"turn the tv volume up to full"
125,6,0,1,1,"open the chips and pour them into the bowl until it is full"
136,0,0,1,1,"get and open the instant ramen"
160,0,0,1,1,"collect all plates , cups , mugs , pot , and silverware and place them in the sink"
160,2,0,1,1,"take the syrup bottles and place them in the refrigerator"
162,0,0,1,1,"take all silverware , plates , cups , and pots and place them in the sink"
163,1,0,1,1,"take all cans , bottles , and garbage and put it in the trash"
164,0,0,1,1,"pick up all books and place them on the shelf"
164,1,0,1,1,"take all bottles , cans , and garbage and place them in the trash"
164,3,0,1,1,"put the cd's , controller , and xbox in the cabinet"
164,4,0,1,1,"take the pillows on the shelf and put them on the couches"
165,1,0,1,1,"take all cans , bottles , and garbage and put it in the trash"
167,2,0,1,1,"take all cans , bottles , and trash and put it in the trash can"
168,0,0,1,1,"take all plates , cups , pots , and silverware and put them in the sink"
168,1,0,1,1,"take all syrup bottles and place them in the fridge"
169,2,0,1,1,"take all pots , cups , plates , and silverware and put them in the sink"
172,1,0,1,1,"wait until the water is boiling , and then take the egg from the fridge and place it in the pot for 3 minutes"
174,1,0,1,1,"take cans , bottles , and trash and put it in the trash can"
174,4,0,1,1,"take the pillows off the shelf and put them on the couch"
177,0,0,1,1,"take all bottles , cans , and trash and put them in the trash can"
178,2,0,1,1,"take all cups , plates , bowls , pots , and silverware and put them into the sink"
182,1,0,1,1,"take all bottles , cans , and trash and put them in the trash can"
183,0,0,1,1,"bring me the coffee from the microwave"
183,2,0,1,1,"serve them to me at the counter"
186,0,0,1,1,"collect all books from the room and place them on the coffee table"
192,3,0,1,1,"bring all the drinks in the room and put them on the table"
199,2,0,1,1,"take pillows and put them on the couch"
201,3,0,1,1,"put chips in bowl and serve"
208,1,0,1,1,"bring me plate with egg on it"
208,2,0,1,1,"bring me a coke"
216,1,0,1,1,"take the bag of chips and the bowl and place them on the coffee table"
219,0,0,1,1,"take the mug and pour its contents on a plate"
220,1,0,1,1,"then put the pot on the stove and turn on the stove"
220,5,0,1,1,"then turn off the microwave and remove the mug"
226,1,0,1,1,"then turn of the tap"
227,1,0,1,1,"then , add chocolate syrup to the mug"
229,2,0,1,1,"then , put the pot on the stove and turn on the stove for two minutes"
233,2,0,1,1,"then add syrup to the mug"
240,1,0,1,1,"take books from shelf and put them on the table"
245,0,0,1,1,"put all the bowls , cups , pots , and utensils in the sink"
248,1,0,1,1,"pick up the books and put them all on the desk"
248,2,0,1,1,"put the cans , bottles , and chip bag in the trash bin"
260,0,0,1,1,"get the pillows and move them onto the couches"
260,1,0,1,1,"then turn on the tv and put a movie inside the xbox"
261,5,0,1,1,"put syrup , ramen , and salt in pantry"
262,0,0,1,1,"bring xbox and controller closer to the tv and set up"
264,1,0,1,1,"then go to the counter and get the plate and put the egg on the plate"
271,2,0,1,1,"fluff pillows on couch and stand them up"
288,1,0,1,1,"when boiling , place in the cup with instant ramen"
295,1,0,1,1,"then put it in the microwave and heat it up"
311,0,0,1,1,"grab the beer , coke and bowl and place them on the coffee table"
311,1,0,1,1,"grab pillows and put them on the couch"
373,3,0,1,1,"then grasp syrup and squeeze the bottle"
386,2,0,1,1,"put plate on plate and put them near the mug"
389,1,0,1,1,"get the food on the table for me"
392,1,0,1,1,"prepare the food and take them to me"
397,2,0,1,1,"prepare food for me"
398,2,0,1,1,"get pillows for me"
399,1,0,1,1,"get some drink for me"
406,1,0,1,1,"then place it on the stove"
412,2,0,1,1,"game cd is on the shelf"
424,1,0,1,1,"then put syrup into the fridge"
434,0,0,1,1,"pour me some orange juice"
441,0,0,1,1,"care me"
444,0,0,1,1,"give me a cup of tea"
446,0,0,1,1,"on"
448,1,0,1,1,"give me some food"
457,9,0,1,1,"and pour chips onto plate"
476,7,0,1,1,"serve"
481,2,0,1,1,"find beer and soda and place them on desk"
489,2,0,1,1,"take food from kitchen counter to game room table"
498,1,0,1,1,"put them away"
511,0,0,1,1,"cook me hot ramen"
521,1,0,1,1,"then , wash the dishes"
539,0,0,1,1,"put all of the dishes into the sink and wash them"
539,1,0,1,1,"then , stack the dishes near the sink to dry"
547,1,0,1,1,"take the pillows from your bed and move them to the couch"
557,0,0,1,1,"pick up plates and cups and put them in the sink"
559,0,0,1,1,"move pillows from the shelf and put them on the couch"
561,2,0,1,1,"take the bag of chips and move them to the couch"
578,1,0,1,1,"gather and arrange ramen , vanilla syrup , and chocolate syrup on the counter"
580,8,0,1,1,"serve the ramen , spoon , and mug"
612,1,0,1,1,"then , take the syrup and squeeze over the cereal"
619,1,0,1,1,"put pop corn in the microwave and serve"
622,1,0,1,1,"serve hot"
648,1,0,1,1,"bring me the book"
648,3,0,1,1,"bring me the chips and bowl"
